<?xml version='1.0' encoding='UTF-8'?>
<!DOCTYPE dr SYSTEM "dr.dtd">
<dr>
<fonctions><f id="s"/><f id="v"/><f id="i"/><f id="_s"/><f id="_v"/></fonctions>
<p><m>Aux</m> <m>délégations</m><pd>,</pd> <m>M.</m> <m>Jonnart</m> <m>a</m> <m>nié</m> <m>que</m> <m>le</m> <m>projet</m> <m>d’</m><m>impôt</m> <m>nouveau</m> <m>fût</m> <m>un</m> <m>artifice</m> <m>pour</m> <m>boucler</m> <m>le</m> <m>budget</m><pd>.</pd></p>
<p><m>Une</m> <m>dizaine</m> <m>de</m> <m>camelots</m> <m>qui</m> <m>criaient</m> <m>le</m> <m>récit</m> <m>d’</m><m>un</m> <m>chimérique</m> <m>attentat</m> <m>anarchiste</m> <m>à</m> <m>la</m> <m>Madeleine</m> <m>ont</m> <m>été</m> <m>arrêtés</m><pd>.</pd></p>
<p><m>Une</m> <m>criminelle</m> <m>mégère</m><pd>,</pd> <m>Mme</m> <m>Tulle</m><pd>,</pd> <m>a</m> <m>eu</m><pd>,</pd> <m>des</m> <m>assises</m> <m>de</m> <m>Rouen</m><pd>,</pd> <m>dix</m> <m>ans</m> <m>de</m> <m>travaux</m> <m>forcés</m><pd>,</pd> <m>et</m> <m>son</m> <m>amant</m> <m>cinq</m> <m>ans</m><pd>.</pd></p>
<p><m>Bernard</m><pd>,</pd> <m>à</m> <m>Essoyes</m> <pg>(</pg><m>Aube</m><pd>)</pd><pd>,</pd> <m>25</m> <m>ans</m><pd>,</pd> <m>a</m> <m>assommé</m> <m>M.</m> <m>Dufert</m><pd>,</pd> <m>qui</m> <m>en</m> <m>a</m> <m>89</m><pd>,</pd> <m>et</m> <m>poignardé</m> <m>sa</m> <m>femme</m><pd>.</pd></p>
</dr>
