<?xml version='1.0' encoding='UTF-8'?>
<!DOCTYPE dr SYSTEM "dr.dtd">
<dr>
<fonctions><f id="s"/><f id="v"/><f id="i"/><f id="_s"/><f id="_v"/></fonctions>
<p><m>Dans</m> <m>un</m> <m>assaut</m><pd>,</pd> <m>le</m> <m>maître</m> <m>d’</m><m>armes</m> <m>Pictori</m> <m>a</m> <m>été</m> <m>blessé</m><pd>,</pd> <m>mortellement</m> <m>peut-être</m><pd>,</pd> <m>par</m> <m>un</m> <m>amateur</m><pd>,</pd> <m>M.</m> <m>Breugnot</m><pd>.</pd></p>
<p><m>Le</m> <m>sombre</m> <m>rôdeur</m> <m>aperçu</m> <m>par</m> <m>le</m> <m>mécanicien</m> <m>Gicquel</m> <m>près</m> <m>de</m> <m>la</m> <m>gare</m> <m>d’</m><m>Herblay</m><pd>,</pd> <m>est</m> <m>retrouvé</m> <pd>:</pd> <m>Jules</m> <m>Ménard</m><pd>,</pd> <m>ramasseur</m> <m>d’</m><m>escargots</m><pd>.</pd></p>
<p><m>Le</m> <m>conseil</m> <m>municipal</m> <m>de</m> <m>Toulon</m> <m>voulait</m> <m>pour</m> <m>la</m> <m>police</m> <m>la</m> <m>journée</m> <m>de</m> <m>huit</m> <m>heures</m><pd>.</pd> <m>Sa</m> <m>délibération</m> <m>est</m> <m>annulée</m> <m>par</m> <m>le</m> <m>préfet</m><pd>.</pd></p>
<p><m>Le</m> <m>ministre</m> <m>des</m> <m>Finances</m> <m>a</m> <m>prescrit</m> <m>aux</m> <m>percepteurs</m> <m>toulonnais</m> <m>d’</m><m>être</m> <m>bénins</m> <m>aux</m> <m>contribuables</m> <m>lésés</m> <m>par</m> <m>les</m> <m>grèves</m><pd>.</pd></p>
</dr>
