<?xml version='1.0' encoding='UTF-8'?>
<!DOCTYPE dr SYSTEM "dr.dtd">
<dr>
<fonctions><f id="s"/><f id="v"/><f id="i"/><f id="_s"/><f id="_v"/></fonctions>
<p><m>En</m> <m>désaccord</m> <m>politique</m><pd>,</pd> <m>MM.</m> <m>Bégouen</m><pd>,</pd> <m>publiciste</m><pd>,</pd> <m>et</m> <m>Bepmale</m><pd>,</pd> <m>député</m><pd>,</pd> <m>s'</m><m>étaient</m> <m>donné</m> <m>du</m> <pg>«</pg> <m>voleur</m> <pd>»</pd> <m>et</m> <m>du</m> <pg>«</pg> <m>lâche</m> <pd>»</pd><pd>.</pd> <m>Réconciliés</m><pd>.</pd></p>
<p><m>Pour</m> <m>son</m> <m>affiche</m> <m>contre</m> <m>les</m> <m>Jaunes</m><pd>,</pd> <m>les</m> <m>externes</m> <m>du</m> <m>lycée</m> <m>de</m> <m>Brest</m> <m>ont</m> <m>conspué</m> <m>leur</m> <m>professeur</m><pd>,</pd> <m>M.</m> <m>Litalien</m><pd>,</pd> <m>adjoint</m> <m>au</m> <m>maire</m><pd>.</pd></p>
<p><m>L'</m><m>infirmière</m> <m>Élise</m> <m>Bachmann</m><pd>,</pd> <m>dont</m> <m>c'</m><m>était</m> <m>hier</m> <m>le</m> <m>jour</m> <m>de</m> <m>sortie</m><pd>,</pd> <m>s'</m><m>est</m> <m>manifestée</m> <m>folle</m> <m>dans</m> <m>la</m> <m>rue</m><pd>.</pd></p>
<p><m>Plainte</m> <m>a</m> <m>été</m> <m>portée</m> <m>par</m> <m>le</m> <m>médecin</m> <m>persan</m> <m>Djaï</m> <m>Khan</m> <m>contre</m> <m>un</m> <m>sien</m> <m>compatriote</m> <m>qui</m> <m>lui</m> <m>vola</m> <m>une</m> <m>tiare</m><pd>.</pd></p>
<p><m>Certaine</m> <m>folle</m> <m>arrêtée</m> <m>dans</m> <m>la</m> <m>rue</m> <m>s'</m><m>était</m> <m>abusivement</m> <m>donnée</m> <m>pour</m> <m>l'</m><m>infirmière</m> <m>Élise</m> <m>Bachmann</m><pd>.</pd> <m>Celle-ci</m> <m>est</m> <m>en</m> <m>parfaite</m> <m>santé</m><pd>.</pd></p>
<p><m>Place</m> <m>du</m> <m>Panthéon</m><pd>,</pd> <m>des</m> <m>électeurs</m> <m>échauffés</m> <m>tentèrent</m> <m>de</m> <m>rôtir</m> <m>un</m> <m>mannequin</m> <m>figurant</m> <m>M.</m> <m>Auffray</m><pd>,</pd> <m>candidat</m> <m>battu</m><pd>.</pd> <m>On</m> <m>les</m> <m>dispersa</m><pd>.</pd></p>
</dr>